{"meta":{"id":"bw_evidence_b7f08565f17476f9","schemaVersion":"boreal.runtime.v1","createdAt":"2026-07-02T06:57:40.568Z","updatedAt":"2026-07-02T06:57:40.568Z","createdBy":{"id":"cybertron","kind":"human","displayName":"cybertron"},"updatedBy":{"id":"cybertron","kind":"human","displayName":"cybertron"},"sourceRefs":[],"tags":[],"contentHash":"sha256:bac772cdd422d8d8bae380ab9daea758a4471351c975c0c8cf60673fd8cb8635"},"subjectId":"bw_work_83d26ba4b699e252","subjectType":"work","kind":"test","summary":"Implemented the seeded in-process next-loop termination harness in tests/runtime/cli-agent-directives.test.ts, covering ready work, active/open declared gates, blocked-chain escalation, idle state, and seeded randomized dependency chains. Hardened file-store lock timing tests that were load-sensitive under the full suite. Validation passed with pnpm test: 35 files, 347 tests.","outcome":"passed","command":"pnpm test","observedAt":"2026-07-02T06:57:40.568Z"}
