{"meta":{"id":"bw_evidence_0778b889c5fd0fd2","schemaVersion":"boreal.runtime.v1","createdAt":"2026-07-04T07:41:58.701Z","updatedAt":"2026-07-04T07:41:58.701Z","createdBy":{"id":"cybertron","kind":"human","displayName":"cybertron"},"updatedBy":{"id":"cybertron","kind":"human","displayName":"cybertron"},"sourceRefs":[],"tags":[],"contentHash":"sha256:ef0f36b22eb50781a92a168ccc8d2132cf59a42c493b349d49f59f7b50a0f8c6"},"subjectId":"bw_work_9ef6934194be3516","subjectType":"work","kind":"command","summary":"Sprint close auto-report doctor passed.","outcome":"passed","command":"bwrk doctor --json","observedAt":"2026-07-04T07:41:58.701Z"}
