{"meta":{"id":"bw_evidence_e5e941306d8c611d","schemaVersion":"boreal.runtime.v1","createdAt":"2026-06-27T06:15:27.462Z","updatedAt":"2026-06-27T06:15:27.462Z","createdBy":{"id":"cybertron","kind":"human","displayName":"cybertron"},"updatedBy":{"id":"cybertron","kind":"human","displayName":"cybertron"},"sourceRefs":[],"tags":[],"contentHash":"sha256:d45dc5a51d1a23f05535fa9acf363b76b3907894ea5538641553dbbba0c4a70d"},"subjectId":"bw_work_caf7f36084c1f3b8","subjectType":"work","kind":"test","summary":"Closed Phase 06B after completing all Sprint Kanban UI child tasks. S06T04 added SprintHeader and SprintScopeSummary; S06T05 hardened SprintKanbanBoard, KanbanColumn, and SprintKanbanCard; S06T06 added query-backed view tabs plus table, dependency, timeline, and progress views. Verification included focused component/app/smoke tests, typecheck, console build, full vitest suite, expanded route smoke, expanded browser smoke across all sprint views, screenshot inspection, sync refresh, and strict doctor.","outcome":"passed","command":"pnpm bwrk work list --label phase-06b --limit 50 --json; pnpm test -- tests/runtime/console-components.test.tsx tests/runtime/console-app.test.tsx tests/runtime/console-smoke.test.ts; pnpm check; pnpm console:build; git diff --check; pnpm test; pnpm console:smoke -- --mode fixture --out .boreal/results/console-route-smoke-s06t06.json; pnpm console:browser-smoke -- --mode fixture --out .boreal/results/console-browser-smoke-s06t06.json; pnpm bwrk sync refresh --session local --json; pnpm bwrk doctor --session local --strict --json","observedAt":"2026-06-27T06:15:27.462Z"}
