{"meta":{"id":"bw_evidence_5a28f04452c5e6c1","schemaVersion":"boreal.runtime.v1","createdAt":"2026-07-01T03:01:32.717Z","updatedAt":"2026-07-01T03:01:32.717Z","createdBy":{"id":"cybertron","kind":"human","displayName":"cybertron"},"updatedBy":{"id":"cybertron","kind":"human","displayName":"cybertron"},"sourceRefs":[],"tags":[],"contentHash":"sha256:132f8b669db5330fd9d21bd2129dade00702e4fa5a45ad7279db09e8f10429aa"},"subjectId":"bw_work_6a9af2fa7ed41af1","subjectType":"work","kind":"command","summary":"gate closeout passed for parent sprint: sync, doctor, schema, docs, and review/audit gate counts are acceptable","outcome":"passed","command":"bwrk gate closeout --json","observedAt":"2026-07-01T03:01:32.717Z"}
