{"meta":{"id":"bw_evidence_1d446d4a21cbb9b9","schemaVersion":"boreal.runtime.v1","createdAt":"2026-07-01T23:14:28.984Z","updatedAt":"2026-07-01T23:14:28.984Z","createdBy":{"id":"cybertron","kind":"human","displayName":"cybertron"},"updatedBy":{"id":"cybertron","kind":"human","displayName":"cybertron"},"sourceRefs":[],"tags":[],"contentHash":"sha256:84afc5b98ebed18f7d6ff16b6c5395f834f70343b90bfbef9f1c553fbba663f2"},"subjectId":"bw_work_495522b74631e3d2","subjectType":"work","kind":"command","summary":"Commit a78b8832 links directive acknowledgement records to evidence, summaries, verifications, artifact URIs, and handoff references; doctor now diagnoses dangling acknowledgement verification, artifact, and handoff links.","outcome":"passed","observedAt":"2026-07-01T23:14:28.984Z"}
