{"meta":{"id":"bw_evidence_b0dc26d5f21cc3a3","schemaVersion":"boreal.runtime.v1","createdAt":"2026-07-07T17:57:31.282Z","updatedAt":"2026-07-07T17:57:31.282Z","createdBy":{"id":"cybertron","kind":"human","displayName":"cybertron"},"updatedBy":{"id":"cybertron","kind":"human","displayName":"cybertron"},"sourceRefs":[],"tags":[],"contentHash":"sha256:4da4e36b04d0ab12e833680c97a171493a1be23631e3ff156ae34a89ab49fa9b"},"subjectId":"bw_work_b4d4261f0cc959ad","subjectType":"work","kind":"command","summary":"Implemented the console global board contract and read-only UI: GlobalBoardView lanes/columns/rails in @boreal/ui-model, live and fixture data wiring, global dashboard rendering, gallery coverage, render-file scope support, and console runtime assertions for stale and missing lanes. Focused test passed: COREPACK_HOME=/private/tmp/corepack pnpm exec vitest run tests/runtime/console-app.test.tsx. pnpm check passed. Commit: 2dee599c.","outcome":"passed","command":"pnpm check","observedAt":"2026-07-07T17:57:31.282Z"}
