{"meta":{"id":"bw_evidence_bad12a546b34ac13","schemaVersion":"boreal.runtime.v1","createdAt":"2026-07-04T00:44:42.711Z","updatedAt":"2026-07-04T00:44:42.711Z","createdBy":{"id":"cybertron","kind":"human","displayName":"cybertron"},"updatedBy":{"id":"cybertron","kind":"human","displayName":"cybertron"},"sourceRefs":[],"tags":[],"contentHash":"sha256:cb7ece22bbd00198129ef5e197d2a52a957dc029a22f8c3ec617ef6f9df6c21a"},"subjectId":"bw_work_8fc2e901435de2fb","subjectType":"work","kind":"diff","summary":"Git finish evidence: HEAD a6192e730ad55a95d282ede804e1f7f7fe591752 on main (dirty); root /Users/cybertron/Code/boreal-work","outcome":"observed","command":"git rev-parse HEAD && git branch --show-current && git status --short","uri":"/Users/cybertron/Code/boreal-work","observedAt":"2026-07-04T00:44:42.711Z"}
