{"meta":{"id":"bw_evidence_1ddbfef39f085224","schemaVersion":"boreal.runtime.v1","createdAt":"2026-07-07T18:34:40.795Z","updatedAt":"2026-07-07T18:34:40.795Z","createdBy":{"id":"cybertron","kind":"human","displayName":"cybertron"},"updatedBy":{"id":"cybertron","kind":"human","displayName":"cybertron"},"sourceRefs":[],"tags":[],"contentHash":"sha256:13f72c4512bdc6824fb99a9b9aa122f9a943d6d34d92028874000de8cab4c863"},"subjectId":"bw_work_e92716edc9d0b645","subjectType":"work","kind":"diff","summary":"Git finish evidence: HEAD d2258e80e83e1303e4c5b3f37e0a3508a05ba26b on main (dirty); root /Users/cybertron/Code/boreal-work","outcome":"observed","command":"git rev-parse HEAD && git branch --show-current && git status --short","uri":"/Users/cybertron/Code/boreal-work","observedAt":"2026-07-07T18:34:40.795Z"}
