{"meta":{"id":"bw_evidence_f352c8700f11f52a","schemaVersion":"boreal.runtime.v1","createdAt":"2026-07-07T15:00:03.127Z","updatedAt":"2026-07-07T15:00:03.127Z","createdBy":{"id":"cybertron","kind":"human","displayName":"cybertron"},"updatedBy":{"id":"cybertron","kind":"human","displayName":"cybertron"},"sourceRefs":[],"tags":[],"contentHash":"sha256:bc0f372ebfe77d4f1fc3640670be8c45c9d9998125545074c6594c424a534043"},"subjectId":"bw_work_b0c02f91b7314d3c","subjectType":"work","kind":"diff","summary":"Git finish evidence: HEAD b72b358e11686e5b45d97577144e99117aa4ae90 on main (dirty); root /Users/cybertron/Code/boreal-work","outcome":"observed","command":"git rev-parse HEAD && git branch --show-current && git status --short","uri":"/Users/cybertron/Code/boreal-work","observedAt":"2026-07-07T15:00:03.127Z"}
