{"meta":{"id":"bw_evidence_da748f1f6987205d","schemaVersion":"boreal.runtime.v1","createdAt":"2026-07-01T18:11:56.519Z","updatedAt":"2026-07-01T18:11:56.519Z","createdBy":{"id":"cybertron","kind":"human","displayName":"cybertron"},"updatedBy":{"id":"cybertron","kind":"human","displayName":"cybertron"},"sourceRefs":[],"tags":[],"contentHash":"sha256:abf155bb962234e8ecc32e77f5e45cca03ac271c8be0b369b1aca4b0ca50ca2c"},"subjectId":"bw_work_759dacd2c62727ad","subjectType":"work","kind":"command","summary":"Closed Phase 03B as a completed directive operator command rollup. Live dependency tree shows no open descendants: S03T04, S03T05, S03T06, and prerequisite Phase 03A are closed. The command family now includes directives list/show/compile/render/explain, registry metadata, JSON output, docs, and shell completion coverage. S03T07 will handle the remaining directive doctor diagnostics in Phase 03C.","outcome":"passed","command":"bwrk dep tree bw_work_759dacd2c62727ad --json","observedAt":"2026-07-01T18:11:56.519Z"}
