{"meta":{"id":"bw_evidence_1e45b21d1d5b923d","schemaVersion":"boreal.runtime.v1","createdAt":"2026-07-13T06:00:47.861Z","updatedAt":"2026-07-13T06:00:47.861Z","createdBy":{"id":"cybertron","kind":"human","displayName":"cybertron"},"updatedBy":{"id":"cybertron","kind":"human","displayName":"cybertron"},"sourceRefs":[],"tags":[],"contentHash":"sha256:246115ac7a382ce6985b0e654c4d3a9773aff9226f193215386e96e4d6a9033d"},"subjectId":"bw_work_1743f7a8c376717e","subjectType":"work","kind":"diff","summary":"Git finish evidence: HEAD b469b6288d1f0a55ee78177db1d7a6d9b3452864 on codex/search-hardening-v2 (dirty); root /Users/cybertron/Code/boreal-work","outcome":"observed","command":"git rev-parse HEAD && git branch --show-current && git status --short","uri":"/Users/cybertron/Code/boreal-work","observedAt":"2026-07-13T06:00:47.861Z","attestation":{"schemaVersion":"boreal.evidence-attestation.v1","trustLevel":"self_reported","producer":{"id":"cybertron","kind":"human","displayName":"cybertron"},"recordedAt":"2026-07-13T06:00:47.861Z"}}
