{"meta":{"id":"bw_evidence_5c9dde267d4fa6bd","schemaVersion":"boreal.runtime.v1","createdAt":"2026-07-02T07:16:50.504Z","updatedAt":"2026-07-02T07:16:50.504Z","createdBy":{"id":"cybertron","kind":"human","displayName":"cybertron"},"updatedBy":{"id":"cybertron","kind":"human","displayName":"cybertron"},"sourceRefs":[],"tags":[],"contentHash":"sha256:dcecc577ffe2beb4341e2990e0907c7cda685ebc3b504ed5e2eab28de4d02243"},"subjectId":"bw_work_1f36933d37fc181d","subjectType":"work","kind":"artifact","summary":"Sprint 5 next-loop dogfood transcript reference: docs/architecture/NEXT_LOOP_DOGFOOD_TRANSCRIPT_2026-07-02.md; child bw_work_4989ec10d44e5e9a closed with artifact bw_evidence_fd19ca5878965506, review evidence bw_evidence_38c615cd2428a836, verification bw_verification_0c545763f7b302b8, and summary bw_summary_8b9ed17797b41341.","outcome":"passed","uri":"docs/architecture/NEXT_LOOP_DOGFOOD_TRANSCRIPT_2026-07-02.md","observedAt":"2026-07-02T07:16:50.504Z"}
