{"meta":{"id":"bw_evidence_608681e24cdf3ad4","schemaVersion":"boreal.runtime.v1","createdAt":"2026-07-04T06:06:28.955Z","updatedAt":"2026-07-04T06:06:28.955Z","createdBy":{"id":"cybertron","kind":"human","displayName":"cybertron"},"updatedBy":{"id":"cybertron","kind":"human","displayName":"cybertron"},"sourceRefs":[],"tags":[],"contentHash":"sha256:983ab7adab88e3e87b718ab2094bd6513d999de68b26151e0312b33e9b993d6d"},"subjectId":"bw_work_963fc14a5f02f660","subjectType":"work","kind":"test","summary":"Implemented per-session agentDirectives sourceHash dedup: stable directive source hashes ignore capture timestamps, repeated unchanged hashes return an unchanged marker, and docs/tests cover the marker contract.","outcome":"passed","command":"COREPACK_HOME=/private/tmp/corepack pnpm check && git diff --check && COREPACK_HOME=/private/tmp/corepack pnpm exec vitest run tests/runtime/cli-agent-directives.test.ts tests/runtime/agent-directive-snapshot.test.ts tests/runtime/output.test.ts tests/runtime/workflow-docs.test.ts && bwrk doctor --strict --json","observedAt":"2026-07-04T06:06:28.955Z"}
