{"meta":{"id":"bw_evidence_090f476b5af56f69","schemaVersion":"boreal.runtime.v1","createdAt":"2026-07-01T03:01:21.113Z","updatedAt":"2026-07-01T03:01:21.113Z","createdBy":{"id":"cybertron","kind":"human","displayName":"cybertron"},"updatedBy":{"id":"cybertron","kind":"human","displayName":"cybertron"},"sourceRefs":[],"tags":[],"contentHash":"sha256:0eb0b26aa4ac8b61174dd1e370dcc1c7ea491c0bb6da2ea05d7db898a122fd76"},"subjectId":"bw_work_6a9af2fa7ed41af1","subjectType":"work","kind":"command","summary":"doctor closeout passed for parent sprint; known warnings are raw-source reconciliation and legacy closeout coverage outside this sprint","outcome":"passed","command":"bwrk doctor --json","observedAt":"2026-07-01T03:01:21.113Z"}
