{"meta":{"id":"bw_evidence_9f8bdd3f719f549f","schemaVersion":"boreal.runtime.v1","createdAt":"2026-06-27T09:54:55.819Z","updatedAt":"2026-06-27T09:54:55.819Z","createdBy":{"id":"cybertron","kind":"human","displayName":"cybertron"},"updatedBy":{"id":"cybertron","kind":"human","displayName":"cybertron"},"sourceRefs":[],"tags":[],"contentHash":"sha256:913491d30ef777e5e17e4b0c27607efd7ff1a9c5017db7e19c71c0e5e9efd3bb"},"subjectId":"bw_work_100b7cc7dcc6e5dd","subjectType":"work","kind":"command","summary":"Phase 08B completed: schema/validator parity, runtime claim/decision wiki page links, wiki coverage doctor diagnostics, and workflow-aware stale truth repair diagnostics are implemented with docs and tests.","outcome":"passed","command":"pnpm check && pnpm test && pnpm console:build && git diff --check && pnpm bwrk sync refresh --json && pnpm bwrk doctor --strict --json","observedAt":"2026-06-27T09:54:55.819Z"}
