{"meta":{"id":"bw_evidence_60b4fd80feb6fbe4","schemaVersion":"boreal.runtime.v1","createdAt":"2026-07-01T04:07:55.900Z","updatedAt":"2026-07-01T04:07:55.900Z","createdBy":{"id":"cybertron","kind":"human","displayName":"cybertron"},"updatedBy":{"id":"cybertron","kind":"human","displayName":"cybertron"},"sourceRefs":[],"tags":[],"contentHash":"sha256:6ab6dd027c17ed96ae06ec422a8f6198d69b0b1cc1d5ce6d3000787a6c8e8634"},"subjectId":"bw_work_d3415afb9c29a1c7","subjectType":"work","kind":"command","summary":"Audited directive-adjacent runtime, CLI, workflow, skill, MCP, daemon, console, spooling, summary, gate, and doctor surfaces. Added docs/architecture/AGENT_DIRECTIVE_SURFACE_AUDIT.md and confirmed no existing agentDirectives or AgentDirective implementation exists in apps, packages, workflows, tests, or installed skills.","outcome":"passed","command":"rg directive code-surface search; git diff --check; bwrk docs check --json; bwrk schema validate --json","uri":"docs/architecture/AGENT_DIRECTIVE_SURFACE_AUDIT.md","observedAt":"2026-07-01T04:07:55.900Z"}
