{"meta":{"id":"bw_evidence_a526740e30273c1e","schemaVersion":"boreal.runtime.v1","createdAt":"2026-07-01T05:09:08.364Z","updatedAt":"2026-07-01T05:09:08.364Z","createdBy":{"id":"cybertron","kind":"human","displayName":"cybertron"},"updatedBy":{"id":"cybertron","kind":"human","displayName":"cybertron"},"sourceRefs":[],"tags":[],"contentHash":"sha256:bcc9061f331c9729926e4f35f24cc6ecee5293cf44e63bbd4c3caf91528e4027"},"subjectId":"bw_work_c30813a1edb7a49f","subjectType":"work","kind":"test","summary":"Implemented S01T06 directive schema/package/import-export contract. Added the core agent directive carrier type, published agent directive bundle schema and schema validator contract, optional validated agentDirectives support on export documents, schema docs, and focused runtime tests. Checkpoint commit b5918f0 contains the scoped code/schema/test changes.","outcome":"passed","command":"pnpm exec tsc -b packages/core/tsconfig.json --pretty false; pnpm exec tsc -p apps/cli/tsconfig.json --pretty false --noEmit --noUnusedLocals false; pnpm exec vitest run tests/runtime/core.test.ts tests/runtime/import-export-directives.test.ts; bwrk docs check --json; bwrk schema validate --json; git diff --check; bwrk sync refresh --json; bwrk doctor --strict --json","observedAt":"2026-07-01T05:09:08.364Z"}
