{"meta":{"id":"bw_evidence_e27abe8899194742","schemaVersion":"boreal.runtime.v1","createdAt":"2026-06-27T02:25:58.609Z","updatedAt":"2026-06-27T02:25:58.609Z","createdBy":{"id":"codex-sprint03-executor","kind":"agent","displayName":"codex-sprint03-executor"},"updatedBy":{"id":"codex-sprint03-executor","kind":"agent","displayName":"codex-sprint03-executor"},"sourceRefs":[],"tags":[],"contentHash":"sha256:38c6449dc194b365b3f5fee6a03ae3ff3f9262c2d676168340bd2610924063e1"},"subjectId":"bw_work_b1ec9c9de728d80d","subjectType":"work","kind":"artifact","summary":"Captured desktop and mobile gallery screenshots with Playwright using system Chrome and recorded a visual audit with five rendered families and no button overflow.","outcome":"passed","uri":".boreal/results/console-gallery-visual-audit.json","observedAt":"2026-06-27T02:25:58.609Z"}
