{"meta":{"id":"bw_evidence_dccb1b14d49e80ca","schemaVersion":"boreal.runtime.v1","createdAt":"2026-07-05T21:46:14.332Z","updatedAt":"2026-07-05T21:46:14.332Z","createdBy":{"id":"cybertron","kind":"human","displayName":"cybertron"},"updatedBy":{"id":"cybertron","kind":"human","displayName":"cybertron"},"sourceRefs":[],"tags":[],"contentHash":"sha256:0d062798ebe2b6c01c1d23857d0abc6f6f015bbb8db146c5c3fb4577d14b04e8"},"subjectId":"bw_work_4d2074fb3e18a3ff","subjectType":"work","kind":"command","summary":"Sprint close auto-report doctor passed.","outcome":"passed","command":"bwrk doctor --json","observedAt":"2026-07-05T21:46:14.332Z"}
