{"meta":{"id":"bw_evidence_ea4e47adaf30ab70","schemaVersion":"boreal.runtime.v1","createdAt":"2026-07-01T13:59:09.131Z","updatedAt":"2026-07-01T13:59:09.131Z","createdBy":{"id":"cybertron","kind":"human","displayName":"cybertron"},"updatedBy":{"id":"cybertron","kind":"human","displayName":"cybertron"},"sourceRefs":[],"tags":[],"contentHash":"sha256:59f093569ca588ef72783e2d37b3171c9eec55cf597f0797ab815172e451351e"},"subjectId":"bw_work_710151bcfda1669e","subjectType":"work","kind":"review","summary":"Sprint 01 descendant review passed for S01T07: static master directive registry is closed with evidence, verification, summary, and checkpoint coverage.","outcome":"passed","observedAt":"2026-07-01T13:59:09.131Z"}
