{"meta":{"id":"bw_evidence_9539679d30674a14","schemaVersion":"boreal.runtime.v1","createdAt":"2026-07-02T06:33:10.710Z","updatedAt":"2026-07-02T06:33:10.710Z","createdBy":{"id":"cybertron","kind":"human","displayName":"cybertron"},"updatedBy":{"id":"cybertron","kind":"human","displayName":"cybertron"},"sourceRefs":[],"tags":[],"contentHash":"sha256:6eca85342c4211e6fce854d426113d0080ff65b4fe82c9f76c4ea154299be15c"},"subjectId":"bw_work_f576e12c21ba3ae8","subjectType":"work","kind":"artifact","summary":"Created the tier 2 execute-at-close gates design note at docs/decisions/tier-2-execute-at-close-gates.md. The note keeps the feature proposal-only, records a default-off RuntimePolicy flag, restricts execution to checked-in declaredCommand strings, defines workspace-root cwd and current-process environment assumptions, requires bounded execution via runBoundedProcess, specifies auto-recorded command evidence, and documents failure semantics for non-zero exit, timeout, output cap, spawn failure, and expected-observable mismatch. Owner sign-off is recorded as design-note-only for this milestone; implementation still requires explicit owner acceptance before any implementation task is opened.","outcome":"passed","command":"sed -n '1,220p' docs/decisions/tier-2-execute-at-close-gates.md","uri":"docs/decisions/tier-2-execute-at-close-gates.md","observedAt":"2026-07-02T06:33:10.710Z"}
