{"meta":{"id":"bw_evidence_1c69fc890f7fc5cb","schemaVersion":"boreal.runtime.v1","createdAt":"2026-06-27T17:46:49.221Z","updatedAt":"2026-06-27T17:46:49.221Z","createdBy":{"id":"cybertron","kind":"human","displayName":"cybertron"},"updatedBy":{"id":"cybertron","kind":"human","displayName":"cybertron"},"sourceRefs":[],"tags":[],"contentHash":"sha256:f6c8d7480593f24aa9fa67b4ef11e6113e511ea2d4bb17bec79dcc6f97572d01"},"subjectId":"bw_work_5f44a349630b97a0","subjectType":"work","kind":"diff","summary":"Partial: deleted dead ConfirmDialog + ActorAvatar (and orphaned initials helper). Remaining: Knowledge tabs/disclosure IA reorg deferred (exceeds the user's chosen 'targeted anti-pattern' styling scope).","outcome":"observed","observedAt":"2026-06-27T17:46:49.221Z"}
