{"meta":{"id":"bw_evidence_e643314d4db3fd84","schemaVersion":"boreal.runtime.v1","createdAt":"2026-07-10T22:34:45.527Z","updatedAt":"2026-07-10T22:34:45.527Z","createdBy":{"id":"cybertron","kind":"human","displayName":"cybertron"},"updatedBy":{"id":"cybertron","kind":"human","displayName":"cybertron"},"sourceRefs":[],"tags":[],"contentHash":"sha256:62a25ae3f532ed8f26ffb1bba7456c4895a5d6d988159a013d342186ccc3e362"},"subjectId":"bw_work_7971e6f401b6bd63","subjectType":"work","kind":"test","summary":"Defined Boreal's technical product wedge, measurable operating invariants, Simple/Team/Governed capability profiles, safety boundaries, non-goals, and explicitly deferred license/public-beta decisions; linked the contract from both documentation indexes.","outcome":"passed","command":"node apps/cli/dist/index.js docs check --json; ./node_modules/.bin/vitest run tests/runtime/workflow-docs.test.ts --reporter=dot; git diff --check","observedAt":"2026-07-10T22:34:45.527Z"}
