{"meta":{"id":"bw_evidence_b383f890e8725f70","schemaVersion":"boreal.runtime.v1","createdAt":"2026-07-02T00:27:48.042Z","updatedAt":"2026-07-02T00:27:48.042Z","createdBy":{"id":"cybertron","kind":"human","displayName":"cybertron"},"updatedBy":{"id":"cybertron","kind":"human","displayName":"cybertron"},"sourceRefs":[],"tags":[],"contentHash":"sha256:daad38945cff14cee6d40ee4d2196266e8a9cd760b00ab7b2fe9abb7cf826d76"},"subjectId":"bw_work_3532e08164c759e6","subjectType":"work","kind":"command","summary":"Final container sync refresh passed after Sprint 05 closeout and operation-log prune; derived state and search were refreshed before container closeout.","outcome":"passed","command":"node apps/cli/dist/index.js sync refresh --workspace . --json","observedAt":"2026-07-02T00:27:48.042Z"}
